{"$schema":"https://artemsemdev.github.io/SeaRise-Europe/contracts/release/v1/quality-summary.schema.json","authority":"automation","automatedValidation":"passed","blockingChecks":[],"dataProvenanceClass":"synthetic-fixture","dataReleaseId":"searise-europe-v1.0.0-20260810-c096aeab4e09","generatedAt":"2026-08-10T12:02:00Z","schemaVersion":"1.0.0","sourceRecordReconciliation":{"accepted":1,"input":1,"rejected":0},"validatedCombinations":9,"validations":[{"category":"schema","evidencePath":"config/scenarios.json","status":"passed"},{"category":"rights","evidencePath":"config/source-attribution.json","status":"passed"},{"category":"hash","evidencePath":"checksums.txt","status":"passed"},{"category":"matrix","evidencePath":"config/scenarios.json","status":"passed"},{"category":"projection-parity","evidencePath":"analysis/projections.parquet","status":"passed"},{"category":"search-reconciliation","evidencePath":"search/settlements.parquet","status":"passed"},{"category":"stac","evidencePath":"stac/catalog.json","status":"passed"},{"category":"provenance","evidencePath":"provenance.intoto.jsonl","status":"passed"}]}
